<?xml version="1.0" encoding="UTF-8"?>
<aggregator xmlns:xsi="http://www.w3.org/2001/XMLSchema-instance"
			xsi:schemaLocation="http://com.disc_au.soap.aggregator ../schema/config.xsd"
			xmlns="http://com.disc_au.soap.aggregator">

	<merge-root>soap-response</merge-root>
	<merge-xsl>merge-results.xsl</merge-xsl>
	<config-dir>aggregator/health_application</config-dir>
	<error-dir>/usr/aih/app-logs/ctm/WEB-INF/aggregator/health_application/errors</error-dir>
	<debug-dir>/usr/aih/app-logs/ctm/WEB-INF/aggregator/health_application/debug</debug-dir>

	<service name="CUA" type="soap">
		<soap-url>https://testservices.cua.com.au/Service.svc</soap-url>
		<soap-action>http://HSL.OMS.Public.API.Service/IService/SubmitMembershipTransaction</soap-action>
		<outbound-xsl>cua/outbound.xsl</outbound-xsl>
		<outbound-xsl-parms>keyname=Choosi,keycode=CTM27ctm</outbound-xsl-parms>
		<inbound-xsl>cua/inbound.xsl</inbound-xsl>
		<maskRequestIn-xsl>maskRequestIn.xsl</maskRequestIn-xsl>
		<maskRequestOut-xsl>maskRequestOutHSL.xsl</maskRequestOut-xsl>
		<timeoutMillis>120000</timeoutMillis>
	</service>

</aggregator>
