<?xml version="1.0" encoding="UTF-8"?>
<aggregator xmlns:xsi="http://www.w3.org/2001/XMLSchema-instance"
			xsi:schemaLocation="http://com.disc_au.soap.aggregator ../schema/config.xsd"
			xmlns="http://com.disc_au.soap.aggregator">

	<merge-root>soap-response</merge-root>
	<merge-xsl>merge-results.xsl</merge-xsl>
	<config-dir>aggregator/health_application</config-dir>
	<error-dir>/usr/aih/app-logs/ctm/WEB-INF/aggregator/health_application/errors</error-dir>
	<debug-dir>/usr/aih/app-logs/ctm/WEB-INF/aggregator/health_application/debug</debug-dir>

	<service name="AUF" type="soap">
		<soap-url>https://b2b.australianunity.com.au/comparethemarket/SalesServices.asmx</soap-url>
		<soap-action>http://ws.australianunity.com.au/B2B/Broker/ProcessApplication</soap-action>
		<ssl-no-host-verify>Y</ssl-no-host-verify>
		<outbound-xsl>auf/outbound.xsl</outbound-xsl>
		<inbound-xsl>auf/inbound.xsl</inbound-xsl>
		<maskRequestIn-xsl>maskRequestIn.xsl</maskRequestIn-xsl>
		<maskRequestOut-xsl>auf/maskRequestOut.xsl</maskRequestOut-xsl>
		<timeoutMillis>120000</timeoutMillis>
	</service>

</aggregator>
