<?xml version="1.0" encoding="UTF-8"?>
<aggregator xmlns:xsi="http://www.w3.org/2001/XMLSchema-instance"
			xsi:schemaLocation="http://com.disc_au.soap.aggregator ../schema/config.xsd"
			xmlns="http://com.disc_au.soap.aggregator">

	<merge-root>soap-response</merge-root>
	<merge-xsl>merge-results.xsl</merge-xsl>
	<config-dir>aggregator/utilities</config-dir>
	<error-dir>/usr/aih/app-logs/ctm/WEB-INF/aggregator/utilities/errors</error-dir>
	<debug-dir>/usr/aih/app-logs/ctm/WEB-INF/aggregator/utilities/debug</debug-dir>
	<validation-file>WEB-INF/xsd/utilities/utilitiesQuoteResults.xsd</validation-file>

	<service name="RESULTS" type="SOAP">
		<soap-url>https://websvc.switchwise.com.au:444/switchwiseCTM_1_5_13/SwitchwiseSearchService.svc/Products/</soap-url>
		<soap-user>ctm</soap-user>
		<soap-password>Ctm#138s</soap-password>
		<outbound-xsl>utilities_products_outbound.xsl</outbound-xsl>
		<outbound-xsl-parms></outbound-xsl-parms>
		<inbound-xsl>utilities_products_inbound.xsl</inbound-xsl>
		<inbound-xsl-parms>defaultProductId=NODEFAULT,service=DEFAULT</inbound-xsl-parms>
		<timeoutMillis>20000</timeoutMillis>
	</service>

</aggregator>
