<?xml version="1.0" encoding="UTF-8"?>
<aggregator xmlns:xsi="http://www.w3.org/2001/XMLSchema-instance"			
			xsi:schemaLocation="http://com.disc_au.soap.aggregator ../schema/config.xsd"
			xmlns="http://com.disc_au.soap.aggregator">
		
	<merge-root>soap-response</merge-root>	
	<merge-xsl>merge-product-selection.xsl</merge-xsl>
	<config-dir>/WEB-INF/aggregator/life</config-dir>
	<error-dir>/WEB-INF/aggregator/life/errors</error-dir>
	<debug-dir>/WEB-INF/aggregator/life/debug</debug-dir>
		
	<service name="APPLY" type="SOAP">
		<soap-url>https://enterpriseapi.lifebroker.com.au/2-3-0/quote/select</soap-url>
		<soap-user>UATcompthemkt</soap-user>
		<soap-password>lI9hW2qIlx2f4G</soap-password>
		<outbound-xsl>life_product_apply_outbound.xsl</outbound-xsl>
		<outbound-xsl-parms></outbound-xsl-parms>
		<inbound-xsl>life_product_apply_inbound.xsl</inbound-xsl>
		<inbound-xsl-parms>defaultProductId=NODEFAULT,service=APPLY</inbound-xsl-parms>
		<timeoutMillis>60000</timeoutMillis>
	</service>	
		
</aggregator>