<?xml version="1.0" encoding="UTF-8"?>
<aggregator xmlns:xsi="http://www.w3.org/2001/XMLSchema-instance"
			xsi:schemaLocation="http://com.disc_au.soap.aggregator ../schema/config.xsd"
			xmlns="http://com.disc_au.soap.aggregator">

	<merge-root>soap-response</merge-root>
	<merge-xsl>merge-results.xsl</merge-xsl>
	<config-dir>aggregator/health_application</config-dir>
	<error-dir>/usr/aih/app-logs/ctm/WEB-INF/aggregator/health_application/errors</error-dir>
	<debug-dir>/usr/aih/app-logs/ctm/WEB-INF/aggregator/health_application/debug</debug-dir>

	<service name="HCF" type="soap">
		<soap-url>https://www.uat.hcf.com.au/EAPP/EAPPService.svc/EnrolNewMember</soap-url>
		<soap-action>https://www.uat.hcf.com.au/EAPP/EAPPService.svc/EnrolNewMember</soap-action>
		<outbound-xsl>hcf/outbound.xsl</outbound-xsl>
		<outbound-xsl-parms>keycode=P@$$w0rd</outbound-xsl-parms>
		<inbound-xsl>hcf/inbound.xsl</inbound-xsl>
		<maskRequestOut-xsl>hcf/maskRequestOut.xsl</maskRequestOut-xsl>
		<maskRequestIn-xsl>maskRequestIn.xsl</maskRequestIn-xsl>
		<maskRespIn-xsl>hcf/maskRespIn.xsl</maskRespIn-xsl>
		<timeoutMillis>240000</timeoutMillis>
		<extract-element>GetHCFSaleInfo</extract-element>
	</service>

</aggregator>
