<?xml version="1.0" encoding="UTF-8"?>
<aggregator xmlns:xsi="http://www.w3.org/2001/XMLSchema-instance"
			xsi:schemaLocation="http://com.disc_au.soap.aggregator ../schema/config.xsd"
			xmlns="http://com.disc_au.soap.aggregator">

	<merge-root>soap-response</merge-root>
	<merge-xsl>merge-results.xsl</merge-xsl>
	<config-dir>aggregator/health_application</config-dir>
	<debug-dir>health_application/app-logs-debug</debug-dir>
	<validation-file>WEB-INF/xsd/health/AUF/healthApplication.xsd</validation-file>

	<service name="AUF" type="soap">
		<soap-url>http://localhost:8080/ctm/broken.jsp</soap-url>
		<soap-action>http://ws.australianunity.com.au/B2B/Broker/ProcessApplication</soap-action>
		<outbound-xsl>auf/outbound.xsl</outbound-xsl>
		<inbound-xsl>auf/inbound.xsl</inbound-xsl>
		<maskRequestIn-xsl>maskRequestIn.xsl</maskRequestIn-xsl>
		<maskRequestOut-xsl>auf/maskRequestOut.xsl</maskRequestOut-xsl>
		<timeoutMillis>240000</timeoutMillis>
	</service>

</aggregator>
