<?xml version="1.0" encoding="UTF-8"?>
<aggregator xmlns:xsi="http://www.w3.org/2001/XMLSchema-instance"
			xsi:schemaLocation="http://com.disc_au.soap.aggregator ../schema/config.xsd"
			xmlns="http://com.disc_au.soap.aggregator">

	<merge-root>soap-response</merge-root>
	<merge-xsl>merge-results.xsl</merge-xsl>
	<config-dir>aggregator/health_application</config-dir>
	<debug-dir>health_application/debug</debug-dir>
	<validation-file>WEB-INF/xsd/health/THF/healthApplication.xsd</validation-file>

	<service name="THF" type="soap">
		<soap-url>https://online.teachershealth.com.au/Service.svc</soap-url>
		<soap-action>http://HSL.OMS.Public.API.Service/IService/SubmitMembershipSTP</soap-action>
		<outbound-xsl>thf/outbound.xsl</outbound-xsl>
		<outbound-xsl-parms>keyname=HFAPctm,keycode=wNxEdqyX</outbound-xsl-parms>
		<inbound-xsl>thf/inbound.xsl</inbound-xsl>
		<maskRequestIn-xsl>maskRequestIn.xsl</maskRequestIn-xsl>
		<maskRequestOut-xsl>maskRequestOutHSL.xsl</maskRequestOut-xsl>
		<timeoutMillis>240000</timeoutMillis>
	</service>

</aggregator>
