<?xml version="1.0" encoding="UTF-8"?>
<aggregator xmlns:xsi="http://www.w3.org/2001/XMLSchema-instance"
			xsi:schemaLocation="http://com.disc_au.soap.aggregator ../schema/config.xsd"
			xmlns="http://com.disc_au.soap.aggregator">

	<merge-root>soap-response</merge-root>
	<merge-xsl>merge-results.xsl</merge-xsl>
	<config-dir>aggregator/roadside</config-dir>
	<debug-dir>roadside/debug</debug-dir>
	<validation-file>WEB-INF/xsd/roadside/roadsidePriceResult.xsd</validation-file>

	<service name="AGIS" type="url-encoded">
		<soap-url>http://127.0.0.1:8080/ctm/rating/roadside_price_result.jsp?providerId=54</soap-url>
		<outbound-xsl>AGIS_outbound.xsl</outbound-xsl>
		<outbound-xsl-parms>partnerId=CC00000001,sourceId=TEST000001</outbound-xsl-parms>
		<inbound-xsl>AGIS_inbound.xsl</inbound-xsl>
		<inbound-xsl-parms>defaultProductId=NODEFAULT,service=AGIS,quoteRoot=https://secure.budgetdirect.com.au</inbound-xsl-parms>
		<timeoutMillis>20000</timeoutMillis>
	</service>

	<service name="1FOW" type="url-encoded">
		<soap-url>http://127.0.0.1:8080/ctm/rating/roadside_price_result.jsp?providerId=44</soap-url>
		<outbound-xsl>1FOW_outbound.xsl</outbound-xsl>
		<outbound-xsl-parms>partnerId=CC00000004,sourceId=TEST000004</outbound-xsl-parms>
		<inbound-xsl>1FOW_inbound.xsl</inbound-xsl>
		<inbound-xsl-parms>defaultProductId=NODEFAULT,service=1FOW,quoteRoot=https://1stforwomen.disconline.com.au</inbound-xsl-parms>
		<timeoutMillis>20000</timeoutMillis>
	</service>

	<service name="24-7" type="url-encoded">
		<soap-url>http://127.0.0.1:8080/ctm/rating/roadside_price_result.jsp?providerId=289</soap-url>
		<outbound-xsl>24-7_outbound.xsl</outbound-xsl>
		<outbound-xsl-parms>partnerId=CC00000010,sourceId=TEST000010</outbound-xsl-parms>
		<inbound-xsl>24-7_inbound.xsl</inbound-xsl>
		<inbound-xsl-parms>defaultProductId=NODEFAULT,service=24-7</inbound-xsl-parms>
		<timeoutMillis>20000</timeoutMillis>
	</service>

	<!--<service name="365R" type="url-encoded">
		<soap-url>http://127.0.0.1:8080/ctm/rating/roadside_price_result.jsp?providerId=302</soap-url>
		<outbound-xsl>365R_outbound.xsl</outbound-xsl>
		<outbound-xsl-parms>partnerId=CC00000010,sourceId=TEST000010</outbound-xsl-parms>
		<inbound-xsl>365R_inbound.xsl</inbound-xsl>
		<inbound-xsl-parms>defaultProductId=NODEFAULT,service=365R</inbound-xsl-parms>
		<timeoutMillis>20000</timeoutMillis>
	</service>-->

	<service name="M247" type="url-encoded">
		<soap-url>http://127.0.0.1:8080/ctm/rating/roadside_price_result.jsp?providerId=313</soap-url>
		<outbound-xsl>M247_outbound.xsl</outbound-xsl>
		<outbound-xsl-parms>partnerId=CC00000010,sourceId=TEST000010</outbound-xsl-parms>
		<inbound-xsl>M247_inbound.xsl</inbound-xsl>
		<inbound-xsl-parms>defaultProductId=NODEFAULT,service=M247</inbound-xsl-parms>
		<timeoutMillis>20000</timeoutMillis>
	</service>

</aggregator>
