<?xml version="1.0" encoding="UTF-8"?>
<aggregator xmlns:xsi="http://www.w3.org/2001/XMLSchema-instance"			
			xsi:schemaLocation="http://com.disc_au.soap.aggregator ../schema/config.xsd"
			xmlns="http://com.disc_au.soap.aggregator">
		
	<merge-root>soap-response</merge-root>	
	<merge-xsl>merge-results.xsl</merge-xsl>
	<config-dir>/aggregator/travel</config-dir>
	<error-dir>/usr/aih/app-logs/ctm/WEB-INF/aggregator/travel/errors</error-dir>
	<debug-dir>/usr/aih/app-logs/ctm/WEB-INF/aggregator/travel/debug</debug-dir>
		
<service name="AMEX" type="url-encoded">
		<soap-url>http://qa.ecommerce.disconline.com.au/cc/rating/travel_price_service_AMEX.jsp</soap-url>
		<outbound-xsl>AMEX_outbound.xsl</outbound-xsl>
		<outbound-xsl-parms>partnerId=CC00000001,sourceId=TEST000001</outbound-xsl-parms>
		<inbound-xsl>AMEX_inbound.xsl</inbound-xsl>
		<inbound-xsl-parms>defaultProductId=NODEFAULT,service=AMEX</inbound-xsl-parms>
		<timeoutMillis>20000</timeoutMillis>
	</service>	
	<service name="AMEX" type="url-encoded">
		<soap-url>http://qa.ecommerce.disconline.com.au/cc/rating/travel_price_service_AMEX_multi.jsp</soap-url>
		<outbound-xsl>AMEX_outbound_multi.xsl</outbound-xsl>
		<outbound-xsl-parms>partnerId=CC00000001,sourceId=TEST000001</outbound-xsl-parms>
		<inbound-xsl>AMEX_inbound.xsl</inbound-xsl>
		<inbound-xsl-parms>defaultProductId=NODEFAULT,service=AMEX</inbound-xsl-parms>
		<timeoutMillis>20000</timeoutMillis>
	</service>	

</aggregator>