<?xml version="1.0" encoding="UTF-8"?>
<aggregator xmlns:xsi="http://www.w3.org/2001/XMLSchema-instance"
			xsi:schemaLocation="http://com.disc_au.soap.aggregator ../schema/config.xsd"
			xmlns="http://com.disc_au.soap.aggregator">

	<merge-root>soap-response</merge-root>
	<config-dir>aggregator/home</config-dir>
	<error-dir>/usr/aih/app-logs/ctm/WEB-INF/aggregator/home/errors</error-dir>
	<debug-dir>home/debug-rein</debug-dir>

	<service name="WOOLINIT" type="soap">
		<soap-url>https://everyone.realinsurance.com.au/v2/AggregatorService.svc</soap-url>
		<soap-action>http://tempuri.org/IAggregatorService/Initialize</soap-action>
		<outbound-xsl>Hollard/init_outbound.xsl</outbound-xsl>
		<outbound-xsl-parms>keyname=ctmprod01,keypass=%^56tgBy,siteKey=WoolworthsHomeBaseCTM</outbound-xsl-parms>
		<inbound-xsl>Hollard/init_inbound.xsl</inbound-xsl>
		<inbound-xsl-parms>productId=WOOL-02-01</inbound-xsl-parms>
		<timeoutMillis>20000</timeoutMillis>
	</service>

</aggregator>
