<?xml version="1.0" encoding="UTF-8"?>
<aggregator xmlns:xsi="http://www.w3.org/2001/XMLSchema-instance"
			xsi:schemaLocation="http://com.disc_au.soap.aggregator ../schema/config.xsd"
			xmlns="http://com.disc_au.soap.aggregator">

	<nabGateway>
		<gatewayURL>https://testservices.qchfund.com.au/NAB/QCH_CTM_IFrame.aspx</gatewayURL>
		<domain>https://testservices.qchfund.com.au</domain>
	</nabGateway>

	<merge-root>soap-response</merge-root>
	<merge-xsl>merge-results.xsl</merge-xsl>
	<config-dir>aggregator/health_application</config-dir>
	<error-dir>aggregator/health_application/app-logs-errors</error-dir>
	<debug-dir>health_application/app-logs-debug</debug-dir>
	<validation-file>WEB-INF/xsd/health/QCH/healthApplication.xsd</validation-file>

	<service name="QCH" type="soap">
		<soap-url>https://testservices.qchfund.com.au/Service.svc</soap-url>
		<soap-action>http://HSL.OMS.Public.API.Service/IService/SubmitMembershipSTP</soap-action>
		<outbound-xsl>qch/outbound.xsl</outbound-xsl>
		<outbound-xsl-parms>keyname=CTM,keycode=compare2015</outbound-xsl-parms>
		<inbound-xsl>qch/inbound.xsl</inbound-xsl>
		<maskRequestIn-xsl>maskRequestIn.xsl</maskRequestIn-xsl>
		<maskRequestOut-xsl>maskRequestOutHSL.xsl</maskRequestOut-xsl>
		<timeoutMillis>240000</timeoutMillis>
		<content-type>application/soap+xml; charset=utf-8</content-type>
	</service>

</aggregator>
