<?xml version="1.0" encoding="UTF-8"?>
<aggregator xmlns:xsi="http://www.w3.org/2001/XMLSchema-instance"
			xsi:schemaLocation="http://com.disc_au.soap.aggregator ../schema/config.xsd"
			xmlns="http://com.disc_au.soap.aggregator">

	<merge-root>soap-response</merge-root>
	<merge-xsl>merge-results.xsl</merge-xsl>
	<config-dir>aggregator/get_prices</config-dir>
	<error-dir>aggregator/get_prices/app-logs-errors</error-dir>
	<debug-dir>aggregator/get_prices/app-logs-debug</debug-dir>

	<service name="AGIS_BUDD" type="soap">
		<soap-url>http://qa.ecommerce.disconline.com.au/services/2.0/getCarQuotes</soap-url>
		<soap-action>getCarQuotes</soap-action>
		<outbound-xsl>AGIS_outbound.xsl</outbound-xsl>
		<outbound-xsl-parms>partnerId=CC00000001,sourceId=TEST000001</outbound-xsl-parms>
		<inbound-xsl>AGIS_inbound.xsl</inbound-xsl>
		<inbound-xsl-parms>defaultProductId=BUDD-05-01</inbound-xsl-parms>
		<timeoutMillis>10000</timeoutMillis>
	</service>

	<service name="AGIS_IECO" type="soap">
		<soap-url>http://qa.ecommerce.disconline.com.au/services/2.0/getCarQuotes</soap-url>
		<soap-action>getCarQuotes</soap-action>
		<outbound-xsl>AGIS_outbound.xsl</outbound-xsl>
		<outbound-xsl-parms>partnerId=CC00000001,sourceId=TEST000002</outbound-xsl-parms>
		<inbound-xsl>AGIS_inbound.xsl</inbound-xsl>
		<inbound-xsl-parms>productId=IECO-05-09</inbound-xsl-parms>
		<timeoutMillis>10000</timeoutMillis>
	</service>

	<service name="AGIS_1FOW" type="soap">
		<soap-url>http://qa.ecommerce.disconline.com.au/services/2.0/getCarQuotes</soap-url>
		<soap-action>getCarQuotes</soap-action>
		<outbound-xsl>AGIS_outbound.xsl</outbound-xsl>
		<outbound-xsl-parms>partnerId=CC00000001,sourceId=TEST000003</outbound-xsl-parms>
		<inbound-xsl>AGIS_inbound.xsl</inbound-xsl>
		<inbound-xsl-parms>productId=1FOW-05-02</inbound-xsl-parms>
		<timeoutMillis>10000</timeoutMillis>
	</service>

	<service name="AGIS_VIRG" type="soap">
		<soap-url>http://qa.ecommerce.disconline.com.au/services/2.0/getCarQuotes</soap-url>
		<soap-action>getCarQuotes</soap-action>
		<outbound-xsl>AGIS_outbound.xsl</outbound-xsl>
		<outbound-xsl-parms>partnerId=CC00000001,sourceId=TEST000004</outbound-xsl-parms>
		<inbound-xsl>AGIS_inbound.xsl</inbound-xsl>
		<inbound-xsl-parms>productId=VIRG-05-11</inbound-xsl-parms>
		<timeoutMillis>10000</timeoutMillis>
	</service>

	<service name="AGIS_RETI" type="soap">
		<soap-url>http://qa.ecommerce.disconline.com.au/services/2.0/getCarQuotes</soap-url>
		<soap-action>getCarQuotes</soap-action>
		<outbound-xsl>AGIS_outbound.xsl</outbound-xsl>
		<outbound-xsl-parms>partnerId=CC00000001,sourceId=TEST000005</outbound-xsl-parms>
		<inbound-xsl>AGIS_inbound.xsl</inbound-xsl>
		<inbound-xsl-parms>productId=RETI-05-03</inbound-xsl-parms>
		<timeoutMillis>10000</timeoutMillis>
	</service>

	<service name="AGIS_CBCK" type="soap">
		<soap-url>http://qa.ecommerce.disconline.com.au/services/2.0/getCarQuotes</soap-url>
		<soap-action>getCarQuotes</soap-action>
		<outbound-xsl>AGIS_outbound.xsl</outbound-xsl>
		<outbound-xsl-parms>partnerId=CC00000001,sourceId=TEST000006</outbound-xsl-parms>
		<inbound-xsl>AGIS_inbound.xsl</inbound-xsl>
		<inbound-xsl-parms>productId=CBCK-05-08</inbound-xsl-parms>
		<timeoutMillis>10000</timeoutMillis>
	</service>

	<service name="AGIS_OZIC" type="soap">
		<soap-url>http://qa.ecommerce.disconline.com.au/services/2.0/getCarQuotes</soap-url>
		<soap-action>getCarQuotes</soap-action>
		<outbound-xsl>AGIS_outbound.xsl</outbound-xsl>
		<outbound-xsl-parms>partnerId=CC00000001,sourceId=TEST000007</outbound-xsl-parms>
		<inbound-xsl>AGIS_inbound.xsl</inbound-xsl>
		<inbound-xsl-parms>defaultProductId=OZIC-05-01</inbound-xsl-parms>
		<timeoutMillis>10000</timeoutMillis>
	</service>

	<service name="AGIS_EXPO" type="soap">
		<soap-url>http://qa.ecommerce.disconline.com.au/services/2.0/getCarQuotes</soap-url>
		<soap-action>getCarQuotes</soap-action>
		<outbound-xsl>AGIS_outbound.xsl</outbound-xsl>
		<outbound-xsl-parms>partnerId=CC00000001,sourceId=TEST000008</outbound-xsl-parms>
		<inbound-xsl>AGIS_inbound.xsl</inbound-xsl>
		<inbound-xsl-parms>productId=EXPO-05-13</inbound-xsl-parms>
		<timeoutMillis>10000</timeoutMillis>
	</service>
<!--
	<service name="REAL_PAYD" type="url-encoded">
		<soap-url>http://uat.realservices.interesting.com.au/Services/Quote</soap-url>
		<outbound-xsl>REAL_outbound.xsl</outbound-xsl>
		<inbound-xsl>REAL_inbound.xsl</inbound-xsl>
		<inbound-xsl-parms>productId=PAYD-01-01,urlRoot=https://uat.realinsurance.interesting.com.au/referrer/</inbound-xsl-parms>
		<timeoutMillis>20000</timeoutMillis>
	</service>

	<service name="AI" type="soap">
		<soap-url>https://119.225.81.101/SSGatewayTest/SSGateway.asmx</soap-url>
		<soap-action>http://www.softsure.co.za/GetSpecifiedVehiclePremium</soap-action>
		<ssl-no-host-verify>Y</ssl-no-host-verify>
		<outbound-xsl>AI_outbound.xsl</outbound-xsl>
		<inbound-xsl>AI_inbound.xsl</inbound-xsl>
		<inbound-xsl-parms>productId=AI-01-01</inbound-xsl-parms>
		<timeoutMillis>10000</timeoutMillis>
	</service>
-->
</aggregator>
